{
  "schemaVersion": "1.0",
  "manifestVersion": "IDN-LICENSE-MANIFEST-v1-2026-07-12",
  "projectLicense": {
    "codeLicenseId": "MIT",
    "notice": "The MIT License covers this application's original code only. It does not relicense third-party data, vendored libraries, or referenced official materials."
  },
  "policy": {
    "productionAssetsFailClosed": true,
    "commercialUseRequiresExplicitStatus": true,
    "redistributionRequiresExplicitStatus": true,
    "checksumRequiredForLocalFiles": true,
    "attributionRequiredWhenLicenseRequiresIt": true,
    "sourceVersionChangeRequiresReview": true
  },
  "assets": [
    {
      "id": "dataset-geoboundaries-idn-adm2-simplified",
      "category": "production-dataset",
      "title": "Indonesia ADM2 simplified production geometry",
      "path": "data/indonesia-adm2-simplified.geojson",
      "publisherOwner": "geoBoundaries / HDX OCHA COD-AB lineage",
      "exactSource": "https://www.geoboundaries.org/api/current/gbOpen/IDN/ADM2/ boundary ID IDN-ADM2-22746128, represented year 2020",
      "sha256": "6d735512fb7cab04ac7ca6048aa41437eba4f53595b83d8da4f25c198ba01f91",
      "mediaType": "application/geo+json",
      "licenseId": "CC-BY-3.0-IGO",
      "commercialUseStatus": "allowed_with_attribution_per_source_metadata",
      "modificationStatus": "simplified and metadata-enriched",
      "redistributionStatus": "approved_with_attribution",
      "attributionRequired": true,
      "attributionText": "Boundary data based on geoBoundaries and HDX/OCHA COD-AB Indonesia ADM2, CC BY 3.0 IGO / CC BY-IGO as reported by source metadata.",
      "review": {
        "status": "approved",
        "reviewer": "Batch 1 data review",
        "date": "2026-07-12"
      },
      "productionApproved": true
    },
    {
      "id": "dataset-geoboundaries-idn-adm2-detailed",
      "category": "production-dataset",
      "title": "Indonesia ADM2 detailed export geometry",
      "path": "data/indonesia-adm2-detailed.geojson",
      "publisherOwner": "geoBoundaries / HDX OCHA COD-AB lineage",
      "exactSource": "https://www.geoboundaries.org/api/current/gbOpen/IDN/ADM2/ boundary ID IDN-ADM2-22746128, represented year 2020",
      "sha256": "5a5cc09736dea030b30536cec6958c8f9aaad4b61f71b1c45500db95bcc360e8",
      "mediaType": "application/geo+json",
      "licenseId": "CC-BY-3.0-IGO",
      "commercialUseStatus": "allowed_with_attribution_per_source_metadata",
      "modificationStatus": "metadata-enriched detailed local copy",
      "redistributionStatus": "approved_with_attribution",
      "attributionRequired": true,
      "attributionText": "Boundary data based on geoBoundaries and HDX/OCHA COD-AB Indonesia ADM2, CC BY 3.0 IGO / CC BY-IGO as reported by source metadata.",
      "review": {
        "status": "approved",
        "reviewer": "Batch 1 data review",
        "date": "2026-07-12"
      },
      "productionApproved": true
    },
    {
      "id": "vendor-leaflet-js",
      "category": "production-library",
      "title": "Leaflet JavaScript",
      "path": "assets/vendor/leaflet/leaflet.js",
      "publisherOwner": "Leaflet contributors",
      "exactSource": "https://leafletjs.com/ version 1.9.4",
      "sha256": "3104b526504d0d61fd3099a4521e87f732ccc3174dec54e08de6ba8bde3e15ff",
      "mediaType": "text/javascript",
      "licenseId": "BSD-2-Clause",
      "commercialUseStatus": "allowed",
      "modificationStatus": "unmodified vendored runtime asset",
      "redistributionStatus": "approved",
      "attributionRequired": true,
      "attributionText": "Leaflet 1.9.4, BSD 2-Clause License, https://leafletjs.com/.",
      "review": {
        "status": "approved",
        "reviewer": "Batch 1 dependency review",
        "date": "2026-07-12"
      },
      "productionApproved": true
    },
    {
      "id": "vendor-leaflet-css",
      "category": "production-library",
      "title": "Leaflet CSS",
      "path": "assets/vendor/leaflet/leaflet.css",
      "publisherOwner": "Leaflet contributors",
      "exactSource": "https://leafletjs.com/ version 1.9.4",
      "sha256": "a7837102824184820dfa198d1ebcd109ff6d0ff9a2672a074b9a1b4d147d04c6",
      "mediaType": "text/css",
      "licenseId": "BSD-2-Clause",
      "commercialUseStatus": "allowed",
      "modificationStatus": "unmodified vendored runtime asset",
      "redistributionStatus": "approved",
      "attributionRequired": true,
      "attributionText": "Leaflet 1.9.4, BSD 2-Clause License, https://leafletjs.com/.",
      "review": {
        "status": "approved",
        "reviewer": "Batch 1 dependency review",
        "date": "2026-07-12"
      },
      "productionApproved": true
    },
    {
      "id": "vendor-leaflet-layers-png",
      "category": "production-image",
      "title": "Leaflet layers icon",
      "path": "assets/vendor/leaflet/images/layers.png",
      "publisherOwner": "Leaflet contributors",
      "exactSource": "https://leafletjs.com/ version 1.9.4",
      "sha256": "1dbbe9d028e292f36fcba8f8b3a28d5e8932754fc2215b9ac69e4cdecf5107c6",
      "mediaType": "image/png",
      "licenseId": "BSD-2-Clause",
      "commercialUseStatus": "allowed",
      "modificationStatus": "unmodified vendored runtime asset",
      "redistributionStatus": "approved",
      "attributionRequired": true,
      "attributionText": "Leaflet 1.9.4, BSD 2-Clause License, https://leafletjs.com/.",
      "review": {
        "status": "approved",
        "reviewer": "Batch 1 dependency review",
        "date": "2026-07-12"
      },
      "productionApproved": true
    },
    {
      "id": "vendor-leaflet-layers-2x-png",
      "category": "production-image",
      "title": "Leaflet layers retina icon",
      "path": "assets/vendor/leaflet/images/layers-2x.png",
      "publisherOwner": "Leaflet contributors",
      "exactSource": "https://leafletjs.com/ version 1.9.4",
      "sha256": "066daca850d8ffbef007af00b06eac0015728dee279c51f3cb6c716df7c42edf",
      "mediaType": "image/png",
      "licenseId": "BSD-2-Clause",
      "commercialUseStatus": "allowed",
      "modificationStatus": "unmodified vendored runtime asset",
      "redistributionStatus": "approved",
      "attributionRequired": true,
      "attributionText": "Leaflet 1.9.4, BSD 2-Clause License, https://leafletjs.com/.",
      "review": {
        "status": "approved",
        "reviewer": "Batch 1 dependency review",
        "date": "2026-07-12"
      },
      "productionApproved": true
    },
    {
      "id": "vendor-leaflet-marker-icon-png",
      "category": "production-image",
      "title": "Leaflet marker icon",
      "path": "assets/vendor/leaflet/images/marker-icon.png",
      "publisherOwner": "Leaflet contributors",
      "exactSource": "https://leafletjs.com/ version 1.9.4",
      "sha256": "574c3a5cca85f4114085b6841596d62f00d7c892c7b03f28cbfa301deb1dc437",
      "mediaType": "image/png",
      "licenseId": "BSD-2-Clause",
      "commercialUseStatus": "allowed",
      "modificationStatus": "unmodified vendored runtime asset",
      "redistributionStatus": "approved",
      "attributionRequired": true,
      "attributionText": "Leaflet 1.9.4, BSD 2-Clause License, https://leafletjs.com/.",
      "review": {
        "status": "approved",
        "reviewer": "Batch 1 dependency review",
        "date": "2026-07-12"
      },
      "productionApproved": true
    },
    {
      "id": "vendor-leaflet-marker-icon-2x-png",
      "category": "production-image",
      "title": "Leaflet marker retina icon",
      "path": "assets/vendor/leaflet/images/marker-icon-2x.png",
      "publisherOwner": "Leaflet contributors",
      "exactSource": "https://leafletjs.com/ version 1.9.4",
      "sha256": "00179c4c1ee830d3a108412ae0d294f55776cfeb085c60129a39aa6fc4ae2528",
      "mediaType": "image/png",
      "licenseId": "BSD-2-Clause",
      "commercialUseStatus": "allowed",
      "modificationStatus": "unmodified vendored runtime asset",
      "redistributionStatus": "approved",
      "attributionRequired": true,
      "attributionText": "Leaflet 1.9.4, BSD 2-Clause License, https://leafletjs.com/.",
      "review": {
        "status": "approved",
        "reviewer": "Batch 1 dependency review",
        "date": "2026-07-12"
      },
      "productionApproved": true
    },
    {
      "id": "vendor-leaflet-marker-shadow-png",
      "category": "production-image",
      "title": "Leaflet marker shadow",
      "path": "assets/vendor/leaflet/images/marker-shadow.png",
      "publisherOwner": "Leaflet contributors",
      "exactSource": "https://leafletjs.com/ version 1.9.4",
      "sha256": "264f5c640339f042dd729062cfc04c17f8ea0f29882b538e3848ed8f10edb4da",
      "mediaType": "image/png",
      "licenseId": "BSD-2-Clause",
      "commercialUseStatus": "allowed",
      "modificationStatus": "unmodified vendored runtime asset",
      "redistributionStatus": "approved",
      "attributionRequired": true,
      "attributionText": "Leaflet 1.9.4, BSD 2-Clause License, https://leafletjs.com/.",
      "review": {
        "status": "approved",
        "reviewer": "Batch 1 dependency review",
        "date": "2026-07-12"
      },
      "productionApproved": true
    },
    {
      "id": "registry-canonical-provinces-v1",
      "category": "registry-artifact",
      "title": "Canonical province registry v1",
      "path": "data/canonical-provinces-v1.csv",
      "publisherOwner": "Project-maintained curation from cited official metadata references",
      "exactSource": "Kepmendagri 300.2.2-2138/2025 and 300.2.2-2430/2025 references cited in source inventory",
      "sha256": "d0b8c535fb52dd14ab1bce61f2f8d2ff01f955cbd4fe773edf4a134c0fab78f6",
      "mediaType": "text/csv",
      "licenseId": "project-curation-with-official-reference-citations",
      "commercialUseStatus": "approved_project_metadata_with_reference_limitations",
      "modificationStatus": "generated from committed curation logic",
      "redistributionStatus": "approved_with_limitations",
      "attributionRequired": true,